<?xml version="1.0" encoding="UTF-8"?>
<xs:schema xmlns:xs="http://www.w3.org/2001/XMLSchema" 
           elementFormDefault="qualified">
  <xs:element name="guitars">
    <xs:complexType>
      <xs:sequence>
        <xs:element ref="guitar" maxOccurs="unbounded"/>
      </xs:sequence>
    </xs:complexType>
  </xs:element>
  
  <xs:element name="back-sides" type="xs:string"/>
  <xs:element name="builder">
    <xs:complexType>
      <xs:simpleContent>
        <xs:extension base="xs:string">
          <xs:attribute name="luthier" default="false">
            <xs:simpleType>
              <xs:restriction base="xs:NMTOKEN">
                <xs:enumeration value="true"/>
                <xs:enumeration value="false"/>
              </xs:restriction>
            </xs:simpleType>
          </xs:attribute>
          <xs:attribute name="smallShop" default="false">
            <xs:simpleType>
              <xs:restriction base="xs:NMTOKEN">
                <xs:enumeration value="true"/>
                <xs:enumeration value="false"/>
              </xs:restriction>
            </xs:simpleType>
          </xs:attribute>
        </xs:extension>
      </xs:simpleContent>
    </xs:complexType>
  </xs:element>
  <xs:element name="guitar">
    <xs:complexType>
      <xs:sequence>
        <xs:element ref="builder"/>
        <xs:element ref="model"/>
        <xs:element ref="back-sides"/>
        <xs:element ref="top"/>
        <xs:element ref="notes" minOccurs="0"/>
      </xs:sequence>
      <xs:attribute name="id" type="xs:string" use="required"/>
    </xs:complexType>
  </xs:element>
 
  <xs:element name="model" type="xs:string"/>
  <xs:element name="notes" type="xs:string"/>
  <xs:element name="top">
    <xs:complexType>
      <xs:simpleContent>
        <xs:extension base="xs:string">
          <xs:attribute name="bearclaw" default="false">
            <xs:simpleType>
              <xs:restriction base="xs:NMTOKEN">
                <xs:enumeration value="true"/>
                <xs:enumeration value="false"/>
              </xs:restriction>
            </xs:simpleType>
          </xs:attribute>
        </xs:extension>
      </xs:simpleContent>
    </xs:complexType>
  </xs:element>
</xs:schema>